Summary,Issue Type,Description,Priority,Labels,Epic Name
"Authentication & Authorization",Epic,"User authentication, role-based access control, and security features. Implement secure login system with JWT tokens, password encryption using bcrypt, role management for HR_ADMIN and HR_RECRUITER, session management with 30-minute timeout, and password reset functionality.",Highest,Feature-Auth,EPIC-CV-01
"CV Upload & Parsing",Epic,"Upload CVs, parse content, and extract candidate information. Build CV upload system supporting PDF/TXT/DOCX formats, implement batch file upload with drag-and-drop, create NLP-based text extraction for skills/experience/education, match skills to taxonomy, and store CV files and metadata.",Highest,Feature-CV-Upload,EPIC-CV-02
"Job Position Management",Epic,"Create and manage job positions with required skills. Implement CRUD operations for job positions, allow defining required and preferred skills, set experience and education requirements, track job status (open/closed), and link candidates to jobs.",High,Feature-Jobs,EPIC-CV-03
"Matching & Ranking Algorithm",Epic,"Match candidates to jobs and rank by compatibility. Develop intelligent matching algorithm using skills matching, experience weighting, education consideration, configurable weights, calculate match score 0-100%, provide ranking explanations, and export rankings.",Highest,Feature-Matching,EPIC-CV-04
"Reports & Analytics",Epic,"Generate insights and reports on candidates and hiring. Create comprehensive reporting dashboard with top skills frequency report, candidate pipeline statistics, time-to-hire metrics, skills gap analysis, PDF/CSV export, date range filtering, and visual charts.",Medium,Feature-Reports,EPIC-CV-05
"Audit Logging",Epic,"Track all system activities for compliance and debugging. Implement complete audit trail logging all CRUD operations, user logins, data access, capture IP and timestamp, provide searchable audit logs, export capability, and retention policy.",Medium,Feature-Audit,EPIC-CV-06
"Dashboard & UI",Epic,"User interface for all system features. Build responsive web interface with main dashboard, navigation menu, responsive design for mobile/desktop, data visualizations, quick action buttons, user profile section, and system notifications.",High,Feature-UI,EPIC-CV-07
